{
  "id": "us-ftc-fake-social-media-indicators",
  "version": "1.0.0",
  "status": "active",
  "verification": "verified",
  "role": "match",
  "title": "Misuse of fake indicators of social media influence",
  "jurisdiction": {
    "code": "US",
    "name": "United States (federal)"
  },
  "instrument": "FTC Trade Regulation Rule on the Use of Consumer Reviews and Testimonials, 16 CFR Part 465",
  "section": "16 CFR 465.8(b), with definitions in 465.1(h) and 465.1(j)",
  "kind": "regulation",
  "binding_note": "A trade regulation rule issued under 15 U.S.C. 57a. In the eCFR text retrieved, section 465.8 is headed \"Misuse of fake indicators of social media influence\".",
  "in_force": {
    "status": "in force",
    "since": null,
    "note": "Source: 89 FR 68077, Aug. 22, 2024, per the eCFR source note. The effective date is not stated in the retrieved text and is left unverified here."
  },
  "sources": [
    {
      "url": "https://www.ecfr.gov/current/title-16/chapter-I/subchapter-D/part-465",
      "retrieved_url": "https://www.ecfr.gov/api/versioner/v1/full/2026-10-19/title-16.xml?part=465",
      "retrieved_at": "2026-10-22",
      "sha256": "0ed274f696f88713e0a1560408acb9b9c611b90959fb686b2afe547df568d6c4",
      "hash_method": "raw-bytes",
      "retrieved_with": "curl",
      "publisher": "Office of the Federal Register and GPO, eCFR",
      "note": "eCFR point-in-time XML for 2026-10-19.",
      "text_sha256": "8a17e77e242835bf309049b0286f8d76d01dc38747b0b8aca39d3f994b247e30"
    }
  ],
  "quotes": [
    {
      "source": 0,
      "locator": "16 CFR 465.8",
      "text": "It is an unfair or deceptive act or practice and a violation of this part for anyone to: (a) Sell or distribute fake indicators of social media influence that they knew or should have known to be fake and that can be used by individuals or businesses to materially misrepresent their influence or importance for a commercial purpose; or (b) Purchase or procure fake indicators of social media influence that they knew or should have known to be fake and that materially misrepresent their influence or importance for a commercial purpose."
    },
    {
      "source": 0,
      "locator": "16 CFR 465.1(h)",
      "text": "Fake indicators of social media influence means indicators of social media influence generated by bots, purported individual accounts not associated with a real individual, accounts created with a real individual's personal information without their consent, or hijacked accounts, or that otherwise do not reflect a real individual's or entity's activities, opinions, findings, or experiences."
    },
    {
      "source": 0,
      "locator": "16 CFR 465.1(j)",
      "text": "Indicators of social media influence means any metrics used by the public to make assessments of an individual's or entity's social media influence, such as followers, friends, connections, subscribers, views, plays, likes, saves, shares, reposts, and comments."
    }
  ],
  "elements": [
    {
      "id": "A",
      "label": "The conduct concerns indicators of social media influence (reposts, likes, followers, comments)",
      "observable_from": "page",
      "required": true,
      "strength": "direct",
      "signals": [
        "shape-outlier-own",
        "bio-template",
        "stock-persona",
        "join-cluster",
        "topic-mismatch",
        "cross-launch"
      ]
    },
    {
      "id": "B",
      "label": "Those indicators are fake: they do not reflect real people's or entities' activities or opinions",
      "observable_from": "page",
      "required": true,
      "strength": "indicative",
      "signals": [
        "shape-outlier-own",
        "bio-template",
        "stock-persona",
        "join-cluster",
        "topic-mismatch",
        "cross-launch"
      ],
      "min_families": 2,
      "note": "Page signals are consistent with fake indicators. They cannot show that a given account is not a real person. Two independent signal families are needed before this element is shown as matched."
    },
    {
      "id": "C",
      "label": "The party purchased or procured them",
      "observable_from": "public-record",
      "required": true,
      "strength": "direct",
      "signals": [],
      "note": "A purchase shows in records such as vendor invoices or enforcement filings. Nothing on the page shows who paid."
    },
    {
      "id": "D",
      "label": "The party knew or should have known they were fake",
      "observable_from": "not-observable",
      "required": true,
      "strength": "direct",
      "signals": []
    },
    {
      "id": "E",
      "label": "They materially misrepresent the party's influence or importance",
      "observable_from": "not-observable",
      "required": true,
      "strength": "direct",
      "signals": [],
      "note": "Materiality is a judgement about how the public reads the numbers."
    },
    {
      "id": "F",
      "label": "For a commercial purpose",
      "observable_from": "page",
      "required": true,
      "strength": "direct",
      "signals": [
        "product-promotion",
        "actor-organisation"
      ]
    }
  ],
  "does_not_prove": "Engagement that looks bought is not proof that anyone bought it, or that the account owner knew. Rivals, fans and vendors acting on their own also produce these patterns. A match on visible elements is a comparison with a published definition. It is not a finding by a court or regulator, and it says nothing about elements Daylight Commons cannot see.",
  "related": [
    "eu-ucpd-annex1-23c-false-reviews-endorsements",
    "uk-dmcc-sch20-13-fake-reviews",
    "x-authenticity-engagement-spam"
  ]
}
