{
  "id": "eu-ucpd-annex1-22-posing-as-consumer",
  "version": "1.0.0",
  "status": "active",
  "verification": "verified",
  "role": "match",
  "title": "Falsely representing oneself as a consumer",
  "jurisdiction": {
    "code": "EU",
    "name": "European Union (applies where consumers in the EU are reached)"
  },
  "instrument": "Unfair Commercial Practices Directive 2005/29/EC, consolidated text of 27.09.2026",
  "section": "Annex I, point 22",
  "kind": "directive",
  "binding_note": "A directive, applied through each Member State's national law. Annex I lists practices that are unfair in all circumstances, and the text says the same single list applies in all Member States. It covers business-to-consumer practices: the party must be a trader.",
  "in_force": {
    "status": "in force",
    "since": null,
    "note": "Original Annex I point, in the 2005 text and unchanged in the consolidated version of 27.09.2026."
  },
  "sources": [
    {
      "url": "https://eur-lex.europa.eu/legal-content/EN/TXT/?uri=CELEX:02005L0029-20260927",
      "retrieved_url": "https://publications.europa.eu/resource/celex/02005L0029-20260927",
      "retrieved_at": "2026-10-22",
      "sha256": "1ebbb7b9f2c7c7712b0c3bd19f4319cb5a52ac9514dc008bd34084c550f77138",
      "hash_method": "raw-bytes",
      "retrieved_with": "curl",
      "publisher": "Publications Office of the European Union (Cellar), consolidated text",
      "note": "EUR-Lex answered scripted requests with an empty 202 challenge, so the same document was read from the Publications Office repository that serves EUR-Lex. Consolidated version 02005L0029-20260927, the latest listed in Cellar on the retrieval date (earlier: 20220528). The consolidated text states it has no legal effect; the Official Journal texts are authentic.",
      "text_sha256": "c2a71254a71bb3f40cbe2a2df8a3c1795c5ff1cf5c32c86742ef3b970294b0ae"
    }
  ],
  "quotes": [
    {
      "source": 0,
      "locator": "Annex I, point 22",
      "text": "Falsely claiming or creating the impression that the trader is not acting for purposes relating to his trade, business, craft or profession, or falsely representing oneself as a consumer."
    }
  ],
  "elements": [
    {
      "id": "A",
      "label": "Posts present the speaker as an ordinary consumer giving their own view",
      "observable_from": "page",
      "required": true,
      "strength": "direct",
      "signals": [
        "undisclosed-lookalike",
        "promo-cue"
      ]
    },
    {
      "id": "B",
      "label": "The speaker is in fact a trader, or acts in the name of or on behalf of one",
      "observable_from": "public-record",
      "required": true,
      "strength": "direct",
      "signals": [],
      "note": "For unlabelled posts this would be shown by contracts or agency records, not by the page."
    },
    {
      "id": "C",
      "label": "The impression is false",
      "observable_from": "not-observable",
      "required": true,
      "strength": "direct",
      "signals": [],
      "note": "Falsity depends on element B and on how the impression was created."
    }
  ],
  "does_not_prove": "A post that reads like a fan and shares a template with paid posts is not proof that its author was paid. A match on visible elements is a comparison with a published definition. It is not a finding by a court or a consumer authority, and it says nothing about elements Daylight Commons cannot see.",
  "related": [
    "uk-dmcc-sch20-25-posing-as-consumer",
    "eu-ucpd-annex1-11-advertorial"
  ]
}
