{
  "id": "eu-dsa-art39-ad-repository",
  "version": "1.0.1",
  "status": "active",
  "verification": "verified",
  "role": "context",
  "title": "Advertisement repositories of very large platforms (context)",
  "jurisdiction": {
    "code": "EU",
    "name": "European Union (applies where consumers in the EU are reached)"
  },
  "instrument": "Digital Services Act, Regulation (EU) 2022/2065",
  "section": "Article 39(1) and 39(2)",
  "kind": "regulation",
  "binding_note": "A regulation that applies directly in every Member State. Articles 26 and 39 set duties for platform providers. CMMNS shows them as context. They tell the reader where the platform must show a disclosure or an ad record.",
  "in_force": {
    "status": "in force",
    "since": null,
    "note": "Article 93(2) sets general application from 17 February 2024. Article 33(6): obligations in the very-large-platform section apply four months after the provider is notified of its designation. Each platform's date follows its own designation, which sits outside this entry."
  },
  "sources": [
    {
      "url": "https://eur-lex.europa.eu/eli/reg/2022/2065/oj",
      "retrieved_url": "https://publications.europa.eu/resource/celex/32022R2065",
      "retrieved_at": "2026-10-22",
      "sha256": "11b119a7d45f3a10cd41714061f9d907839ef5d1634e41774490f00b95856bbf",
      "hash_method": "raw-bytes",
      "retrieved_with": "curl",
      "publisher": "Publications Office of the European Union (Cellar), Official Journal text",
      "note": "Cellar also lists a consolidated version 02022R2065-20221027; Articles 26 and 39 were read from the Official Journal text.",
      "text_sha256": "d4002674e8b0241388512915e12ae1ad780fe0b26eca565fc953339c8e4d8b1f"
    }
  ],
  "quotes": [
    {
      "source": 0,
      "locator": "Article 39(1), first sentence",
      "text": "Providers of very large online platforms or of very large online search engines that present advertisements on their online interfaces shall compile and make publicly available in a specific section of their online interface, through a searchable and reliable tool that allows multicriteria queries and through application programming interfaces, a repository containing the information referred to in paragraph 2, for the entire period during which they present an advertisement and until one year after the advertisement was presented for the last time on their online interfaces."
    },
    {
      "source": 0,
      "locator": "Article 39(2)(b), (c) and (f)",
      "text": "(b) the natural or legal person on whose behalf the advertisement is presented; (c) the natural or legal person who paid for the advertisement, if that person is different from the person referred to in point (b); (f) the commercial communications published on the very large online platforms and identified pursuant to Article 26(2);"
    }
  ],
  "elements": [
    {
      "id": "A",
      "label": "An ad repository exists where the advertiser and payer of an ad can be looked up",
      "observable_from": "public-record",
      "required": true,
      "strength": "direct",
      "signals": [
        "ad-library-link"
      ],
      "note": "CMMNS builds a search link to the repository. The user opens it and reads the results."
    }
  ],
  "does_not_prove": "Context: the repository lists the ads a very large platform recorded. A search shows those records, and organic posts sit outside them. A match compares visible elements with the published text. Courts and consumer authorities decide whether the duty was met.",
  "related": [
    "eu-dsa-art26-advertising"
  ]
}
